{
    "test_id": "golden-flow-checkout",
    "spec_hash": "3DC-SPEC-2026-02-04-a1b2c3d4e5f6",
    "type": "e2e",
    "target": {
        "type": "flow",
        "id": "checkout",
        "path": "/checkout"
    },
    "framework": "playwright",
    "golden_flow": true,
    "cases": [
        {
            "name": "Complete checkout flow",
            "description": "User can complete checkout with valid cart",
            "setup": "Login as customer, add item to cart",
            "action": "Navigate to checkout, fill shipping, submit order",
            "assertion": "Order confirmation page displayed with order ID",
            "priority": "critical"
        },
        {
            "name": "Checkout requires authentication",
            "description": "Unauthenticated users are redirected to login",
            "setup": "Clear session",
            "action": "Navigate directly to /checkout",
            "assertion": "Redirected to login page",
            "priority": "critical"
        },
        {
            "name": "Empty cart prevents checkout",
            "description": "Users cannot checkout with empty cart",
            "setup": "Login as customer, ensure cart is empty",
            "action": "Navigate to /checkout",
            "assertion": "Error message shown, checkout button disabled",
            "priority": "high"
        },
        {
            "name": "Price consistency",
            "description": "Displayed price matches server-calculated price",
            "setup": "Login, add item with known price",
            "action": "Navigate to checkout",
            "assertion": "Total price matches expected calculation",
            "priority": "critical"
        }
    ]
}